{
  "result": "promoted",
  "artifact_id": "copy-plate-ochre-run",
  "kind": "copy",
  "brief_ref": "briefs/autumn-batch-hero.creative-brief.yaml",
  "intent_of_change": "first product description in the plain-catalogue order (ref-plain-catalogue-entry); clay body and size left out because both are UNKNOWN",
  "operation": "write",
  "references": [
    {
      "ref": "references/gold/ref-plain-catalogue-entry.reference.yaml",
      "role": "style_mechanism"
    }
  ],
  "output_files": [
    {
      "path": "work/copy/plate-ochre-run.draft-b.md",
      "sha256": "3901a5742345c0aa4b5f9989a3e9b38427fc85a78e0dfb741e409a034038a4a8"
    }
  ],
  "human_decision": {
    "decision": "approve",
    "by": "Founder (fictional)",
    "date": "2026-10-03",
    "reason": "won pairwise vs draft A (state/feedback.jsonl)"
  },
  "brand_refs": {
    "voice.tone": "b98627c0df778cbf",
    "banned_language.words": "8d9fd869ade2d353",
    "claims.dishwasher_safe": "b5bea41b6c623f7c",
    "business_truth.making_method": "a0e4024e7a4c3a3b",
    "voice.sentence_length": "514c09053f9e5780"
  },
  "skill": "copywriting",
  "version": 1,
  "parent_version": null,
  "created_at": "2026-10-03T04:28:34.888Z"
}
